<GoalLibrary xmlns:xsi="http://www.w3.org/2001/XMLSchema-instance"
xsi:noNamespaceSchemaLocation="./schemas/GoalLibrary.xsd">

    <ActivePursuitGoal name="Eat([target])">
		<PreConditions>
			<Property name="[target](eatable)" operator="=" value="True" />
			<Property name="SELF(has,[target])" operator="=" value="True" />
		</PreConditions>
		<SuccessConditions>
			<NewEvent occurred="True" subject="SELF" action="Eat" target="[target]" />
		</SuccessConditions>
		<FailureConditions>
		</FailureConditions>
		<ExpectedEffects>
			<OnSelect drive="Energy" target="[SELF]" value="+3"/>
		</ExpectedEffects>	
	</ActivePursuitGoal>
	
	<ActivePursuitGoal name="Rest()">
		<PreConditions>
		</PreConditions>
		<SuccessConditions>
			<NewEvent occurred="True" subject="SELF" action="Rests" />
		</SuccessConditions>
		<FailureConditions>
		</FailureConditions>
		<ExpectedEffects>
			<OnSelect drive="Integrity" target="[SELF]" value="+2"/>
		</ExpectedEffects>	
	</ActivePursuitGoal>
	
	<ActivePursuitGoal name="AcceptInvitation([target])">
		<PreConditions>
			<Property name="SELF(invitedBy,[target])" operator="=" value="True" />
			<LikeRelation subject="[SELF]" target="[target]" operator="GreaterThan" value="0" />
		</PreConditions>
		<SuccessConditions>
			<RecentEvent occurred="True" subject="[SELF]" action="SpeechAct" target="[target]" parameters="acceptinvitation"/>
		</SuccessConditions>
		<FailureConditions>
		</FailureConditions>
		<ExpectedEffects>
			<OnSelect drive="Affiliation" target="SELF" value="+4"/>
		</ExpectedEffects>	
	</ActivePursuitGoal>
	
	<ActivePursuitGoal name="RejectInvitation([target])">
		<PreConditions>
			<Property name="SELF(invitedBy,[target])" operator="=" value="True" />
			<LikeRelation subject="[SELF]" target="[target]" operator="LesserThan" value="0" />
		</PreConditions>
		<SuccessConditions>
			<RecentEvent occurred="True" subject="[SELF]" action="SpeechAct" target="[target]" parameters="rejectinvitation"/>
		</SuccessConditions>
		<FailureConditions>
		</FailureConditions>
		<ExpectedEffects>
			<OnSelect drive="Affiliation" target="SELF" value="+2"/>
		</ExpectedEffects>	
	</ActivePursuitGoal>
	

	<ActivePursuitGoal name="RegulateDistress([target])">
		<PreConditions>
			<Property name="[target](isPerson)" operator="=" value="True" />
			<Property name="[target]" operator="!=" value="[SELF]" />
			<LikeRelation subject="[SELF]" target="[target]" operator="GreaterThan" value="0" />
			<EmotionCondition emotion="Distress" agent="[target]" min-intensity="1" />
		</PreConditions>
		<SuccessConditions>
			<!--<NewEvent occurred="True" subject="[target]" action="Smile"/>-->
			<EmotionCondition emotion="JOY" agent="[target]" min-intensity="1" />
		</SuccessConditions>
		<FailureConditions>
		</FailureConditions>
		<ExpectedEffects>
			<OnSelect drive="Affiliation" target="[SELF]" value="+3"/>
		</ExpectedEffects>	
	</ActivePursuitGoal>

	<ActivePursuitGoal name="IncreaseRelation([target])">
		<PreConditions>
			<Property name="[target](isPerson)" operator="=" value="True" />
			<Property name="[target]" operator="!=" value="[SELF]" />
			<!--<RecentEvent occurred="True" subject="SELF" action="look-at" target="[target]"/>-->
			<LikeRelation subject="[SELF]" target="[target]" operator="GreaterThan" value="0" />
			<LikeRelation subject="[target]" target="[SELF]" operator="LesserThan" value="2" />
			<!--<EmotionCondition active="False" emotion="JOY" agent="[target]" min-intensity="1" />-->
		</PreConditions>
		<SuccessConditions>
			<!--<NewEvent occurred="True" subject="[target]" action="Smile"/>-->
			<EmotionCondition emotion="JOY" agent="[target]" min-intensity="1" />
		</SuccessConditions>
		<FailureConditions>
		</FailureConditions>			
		<ExpectedEffects>
			<OnSelect drive="Affiliation" target="[SELF]" value="+4"/>
		</ExpectedEffects>	
	</ActivePursuitGoal>
	<ActivePursuitGoal name="DecreaseRelation([target])">
		<PreConditions>
			<Property name="[target](isPerson)" operator="=" value="True" />
			<Property name="[target]" operator="!=" value="[SELF]" />
			<!--<RecentEvent occurred="True" subject="SELF" action="look-at" target="[target]"/>-->
			<LikeRelation subject="[SELF]" target="[target]" operator="LesserThan" value="0" />
			<LikeRelation subject="[target]" target="[SELF]" operator="GreaterThan" value="-2" />
			<EmotionCondition active="False" emotion="DISTRESS" agent="[target]" min-intensity="1" />
		</PreConditions>
		<SuccessConditions>
			<EmotionCondition emotion="DISTRESS" agent="[target]" min-intensity="1" />
		</SuccessConditions>
		<FailureConditions>
		</FailureConditions>			
		<ExpectedEffects>
			<OnSelect drive="Affiliation" target="[SELF]" value="+4"/>
		</ExpectedEffects>	
	</ActivePursuitGoal>
	
	<ActivePursuitGoal name="EmotionSharing([target])">
		<PreConditions>
			<Property name="[target](isPerson)" operator="=" value="True" />
			<Property name="[target]" operator="!=" value="[SELF]" />
			<LikeRelation subject="[SELF]" target="[target]" operator="GreaterThan" value="0" />
			<EmotionalEpisodeCondition episode="[x]" emotion="[e]" value="3" />
			<RecentEvent occurred="False" subject="[SELF]" action="SpeechAct" target="[target]" parameters="episodesummary,[x],[e]"/>
		</PreConditions>
		<SuccessConditions>
			<NewEvent occurred="True" subject="[SELF]" action="SpeechAct" target="[target]" parameters="episodesummary,[x],[e]"/>
			<NewEvent occurred="True" subject="[target]" action="SpeechAct" target="[SELF]" parameters="showsupport,[e]"/>
		</SuccessConditions>
		<FailureConditions>
			<NewEvent occurred="True" subject="[target]" action="SpeechAct" target="[SELF]" parameters="rejectsupport"/>
		</FailureConditions>
		<ExpectedEffects>
			<OnSelect drive="Affiliation" target="[SELF]" value="+4"/>
		</ExpectedEffects>	
	</ActivePursuitGoal>
	<ActivePursuitGoal name="ProvideSupport([target])">
		<PreConditions>
			<Property name="[target](isPerson)" operator="=" value="True" />
			<Property name="[target]" operator="!=" value="[SELF]" />
			<LikeRelation subject="[SELF]" target="[target]" operator="GreaterThan" value="0" />
			<NewEvent occurred="True" subject="[target]" action="SpeechAct" target="[SELF]" parameters="episodesummary,[x],[e]"/>
		</PreConditions>
		<SuccessConditions>
			<NewEvent occurred="True" subject="[SELF]" action="SpeechAct" target="[target]" parameters="showsupport,[e]"/>
		</SuccessConditions>
		<FailureConditions>
		</FailureConditions>
		<ExpectedEffects>
			<OnSelect drive="Affiliation" target="[target]" value="+4"/>
		</ExpectedEffects>	
	</ActivePursuitGoal>
	<ActivePursuitGoal name="RejectSupport([target])">
		<PreConditions>
			<Property name="[target](isPerson)" operator="=" value="True" />
			<Property name="[target]" operator="!=" value="[SELF]" />
			<LikeRelation subject="[SELF]" target="[target]" operator="LesserThan" value="0" />
			<NewEvent occurred="True" subject="[target]" action="SpeechAct" target="[SELF]" parameters="episodesummary,[x],[e]"/>
		</PreConditions>
		<SuccessConditions>
			<NewEvent occurred="True" subject="[SELF]" action="SpeechAct" target="[target]" parameters="rejectsupport"/>
		</SuccessConditions>
		<FailureConditions>
		</FailureConditions>
		<ExpectedEffects>
			<OnSelect drive="Affiliation" target="SELF" value="+2"/>
		</ExpectedEffects>	
	</ActivePursuitGoal>	
</GoalLibrary>
